23:56:43.179822 IP 127.0.0.1.54818 > 127.0.0.1.1060: Flags [S], seq 132017327, win 65495, options [mss 65495,sackOK,TS val 3031495141 ecr 0,nop,wscale 7], length 0
23:56:43.179844 IP 127.0.0.1.1060 > 127.0.0.1.54818: Flags [S.], seq 1020556649, ack 132017328, win 65483, options [mss 65495,sackOK,TS val 3031495141 ecr 3031495141,nop,wscale 7], length 0
23:56:43.179862 IP 127.0.0.1.54818 > 127.0.0.1.1060: Flags [.], ack 1, win 512, options [nop,nop,TS val 3031495141 ecr 3031495141], length 0
23:56:45.473924 IP 127.0.0.1.54818 > 127.0.0.1.1060: Flags [P.], seq 1:10, ack 1, win 512, options [nop,nop,TS val 3031497435 ecr 3031495141], length 9
23:56:45.474020 IP 127.0.0.1.1060 > 127.0.0.1.54818: Flags [.], ack 10, win 512, options [nop,nop,TS val 3031497435 ecr 3031497435], length 0
23:56:49.675745 IP 127.0.0.1.54818 > 127.0.0.1.1060: Flags [P.], seq 10:19, ack 1, win 512, options [nop,nop,TS val 3031501637 ecr 3031497435], length 9
23:56:49.675831 IP 127.0.0.1.1060 > 127.0.0.1.54818: Flags [.], ack 19, win 512, options [nop,nop,TS val 3031501637 ecr 3031501637], length 0
23:56:50.429552 IP 127.0.0.1.54818 > 127.0.0.1.1060: Flags [F.], seq 19, ack 1, win 512, options [nop,nop,TS val 3031502391 ecr 3031501637], length 0
23:56:50.429752 IP 127.0.0.1.1060 > 127.0.0.1.54818: Flags [F.], seq 1, ack 20, win 512, options [nop,nop,TS val 3031502391 ecr 3031502391], length 0
23:56:50.429935 IP 127.0.0.1.54818 > 127.0.0.1.1060: Flags [.], ack 2, win 512, options [nop,nop,TS val 3031502391 ecr 3031502391], length 0
23:57:04.196662 IP 127.0.0.1.40263 > 127.0.0.1.1060: UDP, length 8
23:57:08.574647 IP 127.0.0.1.40263 > 127.0.0.1.1060: UDP, length 7
23:57:48.625929 IP 127.0.0.1.40263 > 127.0.0.1.1060: UDP, length 99
23:57:53.230051 IP 172.19.160.1.51275 > 239.255.255.250.1900: UDP, length 173
23:57:53.618418 IP 172.19.160.1.51277 > 239.255.255.250.1900: UDP, length 174
23:57:54.240175 IP 172.19.160.1.51275 > 239.255.255.250.1900: UDP, length 173
23:57:54.621067 IP 172.19.160.1.51277 > 239.255.255.250.1900: UDP, length 174
23:57:55.246432 IP 172.19.160.1.51275 > 239.255.255.250.1900: UDP, length 173
23:57:55.628119 IP 172.19.160.1.51277 > 239.255.255.250.1900: UDP, length 174
23:57:56.253845 IP 172.19.160.1.51275 > 239.255.255.250.1900: UDP, length 173
23:57:56.636213 IP 172.19.160.1.51277 > 239.255.255.250.1900: UDP, length 174
23:58:01.501641 IP 127.0.0.1.1060 > 127.0.0.1.40263: UDP, length 35
23:58:07.355564 IP 172.19.175.75.38877 > 172.19.160.1.53: 5514+ A? google.ca. (27)
23:58:07.355579 IP 172.19.175.75.38877 > 172.19.160.1.53: 60595+ AAAA? google.ca. (27)
23:58:07.370517 IP 172.19.160.1.53 > 172.19.175.75.38877: 5514- 9/0/0 A 172.217.3.195, A 216.239.32.10, A 216.239.34.10, A 216.239.36.10, A 216.239.38.10, AAAA 2001:4860:4802:32::a, AAAA 2001:4860:4802:34::a, AAAA 2001:4860:4802:36::a, AAAA 2001:4860:4802:38::a (340)
23:58:07.371414 IP 172.19.160.1.53 > 172.19.175.75.38877: 60595- 9/0/0 AAAA 2607:f8b0:400a:809::2003, A 216.239.32.10, A 216.239.34.10, A 216.239.36.10, A 216.239.38.10, AAAA 2001:4860:4802:32::a, AAAA 2001:4860:4802:34::a, AAAA 2001:4860:4802:36::a, AAAA 2001:4860:4802:38::a (352)
23:58:07.375292 IP 172.19.175.75 > 172.217.3.195: ICMP echo request, id 150, seq 1, length 64
23:58:07.431175 IP 172.217.3.195 > 172.19.175.75: ICMP echo reply, id 150, seq 1, length 64
23:58:07.431520 IP 172.19.175.75.38887 > 172.19.160.1.53: 53974+ PTR? 195.3.217.172.in-addr.arpa. (44)
23:58:07.433594 IP 172.19.160.1.53 > 172.19.175.75.38887: 53974- 10/0/0 PTR sea15s12-in-f3.1e100.net., PTR sea15s12-in-f195.1e100.net., A 216.239.32.10, A 216.239.34.10, A 216.239.36.10, A 216.239.38.10, AAAA 2001:4860:4802:32::a, AAAA 2001:4860:4802:34::a, AAAA 2001:4860:4802:36::a, AAAA 2001:4860:4802:38::a (436)
23:58:08.377572 IP 172.19.175.75 > 172.217.3.195: ICMP echo request, id 150, seq 2, length 64
23:58:08.430172 IP 172.217.3.195 > 172.19.175.75: ICMP echo reply, id 150, seq 2, length 64
23:58:09.379946 IP 172.19.175.75 > 172.217.3.195: ICMP echo request, id 150, seq 3, length 64
23:58:09.431758 IP 172.217.3.195 > 172.19.175.75: ICMP echo reply, id 150, seq 3, length 64
23:58:09.824446 ARP, Request who-has 192.168.0.1 tell 172.19.160.1, length 28
23:58:10.381684 IP 172.19.175.75 > 172.217.3.195: ICMP echo request, id 150, seq 4, length 64
23:58:10.451030 IP 172.217.3.195 > 172.19.175.75: ICMP echo reply, id 150, seq 4, length 64
23:58:10.641555 ARP, Request who-has 192.168.0.1 tell 172.19.160.1, length 28
23:58:11.656200 ARP, Request who-has 192.168.0.1 tell 172.19.160.1, length 28
23:58:12.153806 ARP, Request who-has 172.19.175.75 (00:15:5d:f8:44:60) tell 172.19.160.1, length 28
23:58:12.153832 ARP, Reply 172.19.175.75 is-at 00:15:5d:f8:44:60, length 28
23:58:12.430581 ARP, Request who-has 172.19.160.1 tell 172.19.175.75, length 28
23:58:12.431143 ARP, Reply 172.19.160.1 is-at 00:15:5d:70:26:80, length 28
23:58:24.826675 ARP, Request who-has 192.168.0.1 tell 172.19.160.1, length 28
23:58:25.641297 ARP, Request who-has 192.168.0.1 tell 172.19.160.1, length 28
23:58:26.653706 ARP, Request who-has 192.168.0.1 tell 172.19.160.1, length 28
23:58:59.861334 IP 172.19.175.75.58284 > 172.19.160.1.53: 28631+ A? google.com. (28)
23:58:59.861348 IP 172.19.175.75.58284 > 172.19.160.1.53: 36815+ AAAA? google.com. (28)
23:58:59.902261 IP 172.19.160.1.53 > 172.19.175.75.58284: 28631- 9/0/0 A 172.217.14.206, A 216.239.32.10, A 216.239.34.10, A 216.239.36.10, A 216.239.38.10, AAAA 2001:4860:4802:32::a, AAAA 2001:4860:4802:34::a, AAAA 2001:4860:4802:36::a, AAAA 2001:4860:4802:38::a (342)
23:58:59.934245 IP 172.19.160.1.53 > 172.19.175.75.58284: 36815- 9/0/0 AAAA 2607:f8b0:400a:801::200e, A 216.239.32.10, A 216.239.34.10, A 216.239.36.10, A 216.239.38.10, AAAA 2001:4860:4802:32::a, AAAA 2001:4860:4802:34::a, AAAA 2001:4860:4802:36::a, AAAA 2001:4860:4802:38::a (354)
23:58:59.935020 IP 172.19.175.75.58462 > 172.217.14.206.80: Flags [S], seq 746542532, win 64240, options [mss 1460,sackOK,TS val 3598169846 ecr 0,nop,wscale 7], length 0
23:58:59.978488 IP 172.217.14.206.80 > 172.19.175.75.58462: Flags [S.], seq 2358641935, ack 746542533, win 65535, options [mss 1360,sackOK,TS val 768585386 ecr 3598169846,nop,wscale 8], length 0
23:58:59.978758 IP 172.19.175.75.58462 > 172.217.14.206.80: Flags [.], ack 1, win 502, options [nop,nop,TS val 3598169890 ecr 768585386], length 0
23:58:59.978926 IP 172.19.175.75.58462 > 172.217.14.206.80: Flags [P.], seq 1:7, ack 1, win 502, options [nop,nop,TS val 3598169890 ecr 768585386], length 6: HTTP
23:59:00.041097 IP 172.217.14.206.80 > 172.19.175.75.58462: Flags [.], ack 7, win 256, options [nop,nop,TS val 768585435 ecr 3598169890], length 0
23:59:04.641570 ARP, Request who-has 172.19.175.75 (00:15:5d:f8:44:60) tell 172.19.160.1, length 28
23:59:04.641596 ARP, Reply 172.19.175.75 is-at 00:15:5d:f8:44:60, length 28
23:59:09.830988 ARP, Request who-has 192.168.0.1 tell 172.19.160.1, length 28
23:59:10.649490 ARP, Request who-has 192.168.0.1 tell 172.19.160.1, length 28
23:59:11.650279 ARP, Request who-has 192.168.0.1 tell 172.19.160.1, length 28
23:59:12.057048 IP 172.19.175.75.58462 > 172.217.14.206.80: Flags [F.], seq 7, ack 1, win 502, options [nop,nop,TS val 3598181968 ecr 768585435], length 0
23:59:12.111855 IP 172.217.14.206.80 > 172.19.175.75.58462: Flags [F.], seq 1, ack 8, win 256, options [nop,nop,TS val 768597521 ecr 3598181968], length 0
23:59:12.111904 IP 172.19.175.75.58462 > 172.217.14.206.80: Flags [.], ack 2, win 502, options [nop,nop,TS val 3598182023 ecr 768597521], length 0
23:59:24.817513 ARP, Request who-has 192.168.0.1 tell 172.19.160.1, length 28
23:59:25.645168 ARP, Request who-has 192.168.0.1 tell 172.19.160.1, length 28
23:59:26.647296 ARP, Request who-has 192.168.0.1 tell 172.19.160.1, length 28
23:59:42.812328 IP 127.0.0.1.54822 > 127.0.0.1.1060: Flags [S], seq 976272994, win 65495, options [mss 65495,sackOK,TS val 3031674774 ecr 0,nop,wscale 7], length 0
23:59:42.812343 IP 127.0.0.1.1060 > 127.0.0.1.54822: Flags [R.], seq 0, ack 976272995, win 0, length 0
23:59:51.810700 IP 127.0.0.1.54824 > 127.0.0.1.1060: Flags [S], seq 1217283950, win 65495, options [mss 65495,sackOK,TS val 3031683772 ecr 0,nop,wscale 7], length 0
23:59:51.810714 IP 127.0.0.1.1060 > 127.0.0.1.54824: Flags [R.], seq 0, ack 1217283951, win 0, length 0
23:59:53.242259 IP 172.19.160.1.51354 > 239.255.255.250.1900: UDP, length 173
23:59:53.634113 IP 172.19.160.1.51357 > 239.255.255.250.1900: UDP, length 174
23:59:54.246495 IP 172.19.160.1.51354 > 239.255.255.250.1900: UDP, length 173
23:59:54.637546 IP 172.19.160.1.51357 > 239.255.255.250.1900: UDP, length 174
23:59:55.255425 IP 172.19.160.1.51354 > 239.255.255.250.1900: UDP, length 173
23:59:55.642008 IP 172.19.160.1.51357 > 239.255.255.250.1900: UDP, length 174
23:59:56.270412 IP 172.19.160.1.51354 > 239.255.255.250.1900: UDP, length 173
23:59:56.653161 IP 172.19.160.1.51357 > 239.255.255.250.1900: UDP, length 174
00:00:03.666182 IP 127.0.0.1.54826 > 127.0.0.1.1060: Flags [S], seq 2655597734, win 65495, options [mss 65495,sackOK,TS val 3031695628 ecr 0,nop,wscale 7], length 0
00:00:03.666241 IP 127.0.0.1.1060 > 127.0.0.1.54826: Flags [S.], seq 3296473326, ack 2655597735, win 65483, options [mss 65495,sackOK,TS val 3031695628 ecr 3031695628,nop,wscale 7], length 0
00:00:03.666264 IP 127.0.0.1.54826 > 127.0.0.1.1060: Flags [.], ack 1, win 512, options [nop,nop,TS val 3031695628 ecr 3031695628], length 0
00:00:40.350645 IP 127.0.0.1.54826 > 127.0.0.1.1060: Flags [P.], seq 1:96, ack 1, win 512, options [nop,nop,TS val 3031732312 ecr 3031695628], length 95
00:00:40.350742 IP 127.0.0.1.1060 > 127.0.0.1.54826: Flags [.], ack 96, win 511, options [nop,nop,TS val 3031732312 ecr 3031732312], length 0
00:01:24.026239 IP 127.0.0.1.54826 > 127.0.0.1.1060: Flags [P.], seq 96:163, ack 1, win 512, options [nop,nop,TS val 3031775988 ecr 3031732312], length 67
00:01:24.026377 IP 127.0.0.1.1060 > 127.0.0.1.54826: Flags [.], ack 163, win 511, options [nop,nop,TS val 3031775988 ecr 3031775988], length 0
00:01:36.616893 IP 127.0.0.1.54826 > 127.0.0.1.1060: Flags [P.], seq 163:192, ack 1, win 512, options [nop,nop,TS val 3031788578 ecr 3031775988], length 29
00:01:36.616978 IP 127.0.0.1.1060 > 127.0.0.1.54826: Flags [.], ack 192, win 511, options [nop,nop,TS val 3031788578 ecr 3031788578], length 0
00:01:38.743449 IP 127.0.0.1.54826 > 127.0.0.1.1060: Flags [P.], seq 192:196, ack 1, win 512, options [nop,nop,TS val 3031790705 ecr 3031788578], length 4
00:01:38.743545 IP 127.0.0.1.1060 > 127.0.0.1.54826: Flags [.], ack 196, win 511, options [nop,nop,TS val 3031790705 ecr 3031790705], length 0
00:01:39.520825 IP 127.0.0.1.54826 > 127.0.0.1.1060: Flags [F.], seq 196, ack 1, win 512, options [nop,nop,TS val 3031791482 ecr 3031790705], length 0
00:01:39.521116 IP 127.0.0.1.1060 > 127.0.0.1.54826: Flags [F.], seq 1, ack 197, win 512, options [nop,nop,TS val 3031791483 ecr 3031791482], length 0
00:01:39.521160 IP 127.0.0.1.54826 > 127.0.0.1.1060: Flags [.], ack 2, win 512, options [nop,nop,TS val 3031791483 ecr 3031791483], length 0
00:01:53.246124 IP 172.19.160.1.63095 > 239.255.255.250.1900: UDP, length 173
00:01:53.676824 IP 172.19.160.1.63099 > 239.255.255.250.1900: UDP, length 174
00:01:54.254462 IP 172.19.160.1.63095 > 239.255.255.250.1900: UDP, length 173
00:01:54.685742 IP 172.19.160.1.63099 > 239.255.255.250.1900: UDP, length 174
00:01:55.266347 IP 172.19.160.1.63095 > 239.255.255.250.1900: UDP, length 173
00:01:55.700768 IP 172.19.160.1.63099 > 239.255.255.250.1900: UDP, length 174
00:01:56.267118 IP 172.19.160.1.63095 > 239.255.255.250.1900: UDP, length 173
00:01:56.707973 IP 172.19.160.1.63099 > 239.255.255.250.1900: UDP, length 174
00:02:04.314627 IP 127.0.0.1.38352 > 127.0.0.1.1060: UDP, length 18
00:02:09.030914 IP 127.0.0.1.38352 > 127.0.0.1.1060: UDP, length 17
00:02:28.531878 IP 127.0.0.1.38352 > 127.0.0.1.1060: UDP, length 15
00:02:41.124908 IP 127.0.0.1.38352 > 127.0.0.1.1060: UDP, length 19
00:03:01.136422 IP 127.0.0.1.1060 > 127.0.0.1.38352: UDP, length 42
00:03:44.684139 IP 127.0.0.1.1060 > 127.0.0.1.38352: UDP, length 32
00:03:53.246873 IP 172.19.160.1.50921 > 239.255.255.250.1900: UDP, length 173
00:03:53.633993 IP 172.19.160.1.55779 > 239.255.255.250.1900: UDP, length 174
00:03:54.254604 IP 172.19.160.1.50921 > 239.255.255.250.1900: UDP, length 173
00:03:54.642521 IP 172.19.160.1.55779 > 239.255.255.250.1900: UDP, length 174
00:03:55.266734 IP 172.19.160.1.50921 > 239.255.255.250.1900: UDP, length 173
00:03:55.656811 IP 172.19.160.1.55779 > 239.255.255.250.1900: UDP, length 174
00:03:56.274674 IP 172.19.160.1.50921 > 239.255.255.250.1900: UDP, length 173
00:03:56.661250 IP 172.19.160.1.55779 > 239.255.255.250.1900: UDP, length 174
00:03:57.216994 IP 172.19.175.75.37753 > 172.19.160.1.53: 48485+ A? outlook.com. (29)
00:03:57.217009 IP 172.19.175.75.37753 > 172.19.160.1.53: 59263+ AAAA? outlook.com. (29)
00:03:57.637404 IP 172.19.160.1.53 > 172.19.175.75.37753: 48485- 15/0/0 A 40.97.153.146, A 40.97.148.226, A 40.97.156.114, A 40.97.161.50, A 40.97.128.194, A 40.97.160.2, A 40.97.164.146, A 40.97.116.82, A 104.47.38.8, A 104.47.2.8, A 104.47.40.8, A 104.47.121.8, A 150.171.10.38, A 150.171.16.38, A 13.107.222.38 (432)
00:03:57.748927 IP 172.19.160.1.53 > 172.19.175.75.37753: 59263 0/1/0 (125)
00:03:57.751209 IP 172.19.175.75 > 40.97.153.146: ICMP echo request, id 160, seq 1, length 64
00:03:57.941209 IP 40.97.153.146 > 172.19.175.75: ICMP echo reply, id 160, seq 1, length 64
00:03:57.941651 IP 172.19.175.75.35392 > 172.19.160.1.53: 38847+ PTR? 146.153.97.40.in-addr.arpa. (44)
00:03:58.249914 IP 172.19.160.1.5353 > 224.0.0.251.5353: 0 PTR (QM)? 146.153.97.40.in-addr.arpa.local. (50)
00:03:58.251095 IP6 fe80::30b0:41c8:fa25:f83b.5353 > ff02::fb.5353: 0 PTR (QM)? 146.153.97.40.in-addr.arpa.local. (50)
00:03:59.262747 IP 172.19.160.1.5353 > 224.0.0.251.5353: 0 PTR (QM)? 146.153.97.40.in-addr.arpa.local. (50)
00:03:59.263497 IP6 fe80::30b0:41c8:fa25:f83b.5353 > ff02::fb.5353: 0 PTR (QM)? 146.153.97.40.in-addr.arpa.local. (50)
00:03:59.307077 IP 172.19.160.1.53 > 172.19.175.75.35392: 38847 NXDomain 0/1/0 (130)
00:03:59.307515 IP 172.19.175.75 > 40.97.153.146: ICMP echo request, id 160, seq 2, length 64
00:03:59.477060 IP 40.97.153.146 > 172.19.175.75: ICMP echo reply, id 160, seq 2, length 64
00:04:02.141480 ARP, Request who-has 172.19.175.75 (00:15:5d:f8:44:60) tell 172.19.160.1, length 28
00:04:02.141508 ARP, Reply 172.19.175.75 is-at 00:15:5d:f8:44:60, length 28
00:04:02.270970 ARP, Request who-has 172.19.160.1 tell 172.19.175.75, length 28
00:04:02.271534 ARP, Reply 172.19.160.1 is-at 00:15:5d:70:26:80, length 28
00:04:02.652433 IP 172.19.160.1.53 > 172.19.175.75.35392: 38847 NXDomain 0/1/0 (130)
00:04:02.652526 IP 172.19.175.75 > 172.19.160.1: ICMP 172.19.175.75 udp port 35392 unreachable, length 166
00:04:03.939536 IP 172.19.160.1.1900 > 239.255.255.250.1900: UDP, length 491
00:04:03.940408 IP6 fe80::30b0:41c8:fa25:f83b.1900 > ff02::c.1900: UDP, length 500
00:04:04.211515 IP 172.19.160.1.1900 > 239.255.255.250.1900: UDP, length 450
00:04:04.212056 IP6 fe80::30b0:41c8:fa25:f83b.1900 > ff02::c.1900: UDP, length 459
00:04:04.332802 IP 172.19.160.1.1900 > 239.255.255.250.1900: UDP, length 489
00:04:04.333303 IP6 fe80::30b0:41c8:fa25:f83b.1900 > ff02::c.1900: UDP, length 498
00:04:05.339828 IP 172.19.160.1.53 > 172.19.175.75.35392: 38847 NXDomain 0/1/0 (130)
00:04:05.339876 IP 172.19.175.75 > 172.19.160.1: ICMP 172.19.175.75 udp port 35392 unreachable, length 166
00:04:06.437416 IP 172.19.160.1.1900 > 239.255.255.250.1900: UDP, length 441
00:04:06.438005 IP6 fe80::30b0:41c8:fa25:f83b.1900 > ff02::c.1900: UDP, length 450
00:04:06.956224 IP 172.19.160.1.1900 > 239.255.255.250.1900: UDP, length 491
00:04:06.956845 IP6 fe80::30b0:41c8:fa25:f83b.1900 > ff02::c.1900: UDP, length 500
00:04:07.218344 IP 172.19.160.1.1900 > 239.255.255.250.1900: UDP, length 450
00:04:07.219022 IP6 fe80::30b0:41c8:fa25:f83b.1900 > ff02::c.1900: UDP, length 459
00:04:07.338346 IP 172.19.160.1.1900 > 239.255.255.250.1900: UDP, length 489
00:04:07.339042 IP6 fe80::30b0:41c8:fa25:f83b.1900 > ff02::c.1900: UDP, length 498
00:04:08.340848 IP 172.19.160.1.53 > 172.19.175.75.35392: 38847 NXDomain 0/1/0 (130)
00:04:08.340895 IP 172.19.175.75 > 172.19.160.1: ICMP 172.19.175.75 udp port 35392 unreachable, length 166
00:04:09.448105 IP 172.19.160.1.1900 > 239.255.255.250.1900: UDP, length 441
00:04:09.448892 IP6 fe80::30b0:41c8:fa25:f83b.1900 > ff02::c.1900: UDP, length 450
00:04:09.824493 ARP, Request who-has 192.168.0.1 tell 172.19.160.1, length 28
00:04:09.965001 IP 172.19.160.1.1900 > 239.255.255.250.1900: UDP, length 491
00:04:09.965473 IP6 fe80::30b0:41c8:fa25:f83b.1900 > ff02::c.1900: UDP, length 500
00:04:10.233039 IP 172.19.160.1.1900 > 239.255.255.250.1900: UDP, length 450
00:04:10.233738 IP6 fe80::30b0:41c8:fa25:f83b.1900 > ff02::c.1900: UDP, length 459
00:04:10.350743 IP 172.19.160.1.1900 > 239.255.255.250.1900: UDP, length 489
00:04:10.351631 IP6 fe80::30b0:41c8:fa25:f83b.1900 > ff02::c.1900: UDP, length 498
00:04:10.650911 ARP, Request who-has 192.168.0.1 tell 172.19.160.1, length 28
00:04:11.641094 ARP, Request who-has 192.168.0.1 tell 172.19.160.1, length 28
00:04:12.456064 IP 172.19.160.1.1900 > 239.255.255.250.1900: UDP, length 441
00:04:12.456703 IP6 fe80::30b0:41c8:fa25:f83b.1900 > ff02::c.1900: UDP, length 450
00:05:03.631055 IP6 fe80::215:5dff:fef8:4460 > ff02::2: ICMP6, router solicitation, length 16
00:05:41.610461 IP 127.0.0.1.42075 > 127.0.0.1.1060: UDP, length 67
00:05:41.610492 IP 127.0.0.1 > 127.0.0.1: ICMP 127.0.0.1 udp port 1060 unreachable, length 103
00:05:53.259611 IP 172.19.160.1.63806 > 239.255.255.250.1900: UDP, length 173
00:05:53.633928 IP 172.19.160.1.63808 > 239.255.255.250.1900: UDP, length 174
00:05:54.265078 IP 172.19.160.1.63806 > 239.255.255.250.1900: UDP, length 173
00:05:54.650317 IP 172.19.160.1.63808 > 239.255.255.250.1900: UDP, length 174
00:05:55.272767 IP 172.19.160.1.63806 > 239.255.255.250.1900: UDP, length 173
00:05:55.659965 IP 172.19.160.1.63808 > 239.255.255.250.1900: UDP, length 174
00:05:56.281523 IP 172.19.160.1.63806 > 239.255.255.250.1900: UDP, length 173
00:05:56.661434 IP 172.19.160.1.63808 > 239.255.255.250.1900: UDP, length 174
00:06:05.147137 IP 127.0.0.1.60010 > 127.0.0.1.1060: UDP, length 52
00:06:05.147161 IP 127.0.0.1 > 127.0.0.1: ICMP 127.0.0.1 udp port 1060 unreachable, length 88
00:06:29.933587 IP 127.0.0.1 > 127.0.0.1: ICMP echo request, id 163, seq 1, length 64
00:06:29.933608 IP 127.0.0.1 > 127.0.0.1: ICMP echo reply, id 163, seq 1, length 64
00:06:30.991155 IP 127.0.0.1 > 127.0.0.1: ICMP echo request, id 163, seq 2, length 64
00:06:30.991175 IP 127.0.0.1 > 127.0.0.1: ICMP echo reply, id 163, seq 2, length 64
00:06:32.031124 IP 127.0.0.1 > 127.0.0.1: ICMP echo request, id 163, seq 3, length 64
00:06:32.031143 IP 127.0.0.1 > 127.0.0.1: ICMP echo reply, id 163, seq 3, length 64
00:06:33.071234 IP 127.0.0.1 > 127.0.0.1: ICMP echo request, id 163, seq 4, length 64
00:06:33.071257 IP 127.0.0.1 > 127.0.0.1: ICMP echo reply, id 163, seq 4, length 64
00:06:34.111006 IP 127.0.0.1 > 127.0.0.1: ICMP echo request, id 163, seq 5, length 64
00:06:34.111025 IP 127.0.0.1 > 127.0.0.1: ICMP echo reply, id 163, seq 5, length 64
00:06:35.151128 IP 127.0.0.1 > 127.0.0.1: ICMP echo request, id 163, seq 6, length 64
00:06:35.151147 IP 127.0.0.1 > 127.0.0.1: ICMP echo reply, id 163, seq 6, length 64
00:06:36.191283 IP 127.0.0.1 > 127.0.0.1: ICMP echo request, id 163, seq 7, length 64
00:06:36.191304 IP 127.0.0.1 > 127.0.0.1: ICMP echo reply, id 163, seq 7, length 64
00:07:53.263629 IP 172.19.160.1.56155 > 239.255.255.250.1900: UDP, length 173
00:07:53.635887 IP 172.19.160.1.56157 > 239.255.255.250.1900: UDP, length 174
00:07:54.271732 IP 172.19.160.1.56155 > 239.255.255.250.1900: UDP, length 173
00:07:54.636806 IP 172.19.160.1.56157 > 239.255.255.250.1900: UDP, length 174
00:07:55.271999 IP 172.19.160.1.56155 > 239.255.255.250.1900: UDP, length 173
00:07:55.645143 IP 172.19.160.1.56157 > 239.255.255.250.1900: UDP, length 174
00:07:56.274928 IP 172.19.160.1.56155 > 239.255.255.250.1900: UDP, length 173
00:07:56.647158 IP 172.19.160.1.56157 > 239.255.255.250.1900: UDP, length 174
